{
  "schemaVersion": "1.0.0",
  "id": "intent-arcwell-health-experience",
  "title": "Arcwell AI health marketing site and personal dashboard",
  "scope": {
    "level": "product",
    "surface": "marketing-site-and-authenticated-web-app",
    "parentIntentId": null
  },
  "outcome": {
    "problem": "People who collect health data across wearables, symptoms, medications, and appointments still struggle to understand what changed, what is reliable, and what to discuss with a clinician.",
    "desiredChange": "A health-conscious adult can understand recent non-diagnostic patterns, inspect their sources and limits, take one appropriate next step, and prepare a concise clinician-ready summary without mistaking AI output for medical advice.",
    "antiGoals": [
      "Diagnose a condition or replace a licensed clinician",
      "Create anxiety through alarmist scoring or constant notifications",
      "Hide uncertainty, source quality, data gaps, or the product safety boundary",
      "Imitate a competitor's visual system or conversion sequence"
    ]
  },
  "audiences": [
    {
      "id": "health-tracker",
      "label": "Adult managing health between appointments",
      "context": "Uses a wearable and keeps occasional symptom or medication notes, but sees data in separate tools and wants useful context before an upcoming appointment.",
      "needs": [
        "See what changed without interpreting raw charts alone",
        "Know which source and time range support an insight",
        "Prepare useful questions for a clinician",
        "Control connected data and AI processing"
      ],
      "anxieties": [
        "An AI system making an unsafe diagnosis",
        "Sensitive health data being sold or used unexpectedly",
        "Normal variation being presented as a crisis",
        "Missing or delayed device data creating a false conclusion"
      ],
      "capabilities": [
        "Can connect a wearable account",
        "Can review a plain-language evidence trail",
        "Can contact a clinician or emergency service when directed"
      ]
    },
    {
      "id": "care-partner",
      "label": "Trusted family member or care partner",
      "context": "Helps another adult organize appointments, medication details, and recent changes with explicit permission.",
      "needs": [
        "Understand what information is shared",
        "See upcoming care tasks and a concise history",
        "Avoid changing clinical information accidentally"
      ],
      "anxieties": [
        "Access extending beyond the person's consent",
        "Confusing wellness guidance with a care plan"
      ],
      "capabilities": [
        "Can review and export a summary",
        "Can help prepare appointment questions"
      ]
    }
  ],
  "tasks": {
    "primary": {
      "actorId": "health-tracker",
      "action": "review",
      "object": "a source-grounded weekly health brief and choose an appropriate next step",
      "completionSignal": "the user opens the evidence behind the weekly brief and saves or dismisses one next step"
    },
    "secondary": [
      {
        "actorId": "health-tracker",
        "action": "prepare",
        "object": "a clinician conversation summary",
        "completionSignal": "the user exports or copies the summary with sources, date range, questions, and AI limitations"
      },
      {
        "actorId": "health-tracker",
        "action": "control",
        "object": "connected data and AI permissions",
        "completionSignal": "the user reviews data sources and changes, exports, or deletes a permission"
      },
      {
        "actorId": "care-partner",
        "action": "inspect",
        "object": "the explicitly shared care summary",
        "completionSignal": "the care partner views the permitted summary without access to excluded data"
      }
    ]
  },
  "brand": {
    "values": [
      {
        "name": "grounded clarity",
        "expression": "Every insight names the observation, source, time range, confidence, and appropriate next step in plain language.",
        "avoid": "Opaque health scores, unexplained recommendations, or clinical-sounding certainty."
      },
      {
        "name": "calm agency",
        "expression": "The interface prioritizes useful action and user control without manufacturing urgency.",
        "avoid": "Fear-based alerts, streak pressure, or moral judgment about health behavior."
      },
      {
        "name": "visible boundaries",
        "expression": "Safety limits, data gaps, privacy controls, and escalation paths are part of the main experience.",
        "avoid": "Disclaimers hidden in legal copy or trust claims without operational detail."
      }
    ],
    "voice": [
      "plain",
      "measured",
      "specific",
      "non-diagnostic"
    ],
    "distinctiveAssets": [
      "longitudinal health thread",
      "source chips",
      "confidence bands",
      "clinician conversation brief"
    ],
    "referencePolicy": "abstract-principles-only"
  },
  "experience": {
    "emotionalRegister": [
      "calm",
      "capable",
      "respected"
    ],
    "density": "The marketing site is spacious around decisions and explicit around proof; the dashboard is information-rich but reveals evidence in layers.",
    "familiarity": "Conventional navigation, forms, tables, and dialogs support a distinctive longitudinal health-thread composition.",
    "motion": "Short transitions explain changes in time range or source; all meaning remains available when reduced motion is active.",
    "hierarchy": "One current health brief and one next step lead the dashboard; source quality, care preparation, and data controls remain directly reachable."
  },
  "success": {
    "criteria": [
      {
        "id": "qualified-start",
        "signal": "Visitors who understand the non-diagnostic boundary and start a connected-data trial",
        "direction": "increase",
        "target": "At least 10 percent of qualified marketing sessions",
        "weight": 0.3
      },
      {
        "id": "brief-evidence-review",
        "signal": "Active users who inspect evidence behind a weekly brief before acting",
        "direction": "increase",
        "target": "At least 60 percent",
        "weight": 0.35
      },
      {
        "id": "clinician-preparation",
        "signal": "Active users who save or export a clinician conversation summary before an appointment",
        "direction": "increase",
        "target": "At least 35 percent of users with an appointment in the next 14 days",
        "weight": 0.25
      },
      {
        "id": "unsafe-interpretation",
        "signal": "Research participants who believe Arcwell provides a diagnosis or emergency monitoring",
        "direction": "decrease",
        "target": "Below 5 percent",
        "weight": 0.1
      }
    ],
    "qualityProfile": {
      "weights": {
        "intentAlignment": 0.18,
        "taskClarity": 0.16,
        "accessibility": 0.16,
        "safetyClarity": 0.16,
        "hierarchy": 0.1,
        "visualCoherence": 0.09,
        "distinctiveness": 0.05,
        "responsiveResilience": 0.06,
        "maintainability": 0.04
      },
      "floors": {
        "accessibility": 0.85,
        "safetyClarity": 0.88,
        "taskClarity": 0.78,
        "responsiveResilience": 0.75
      },
      "uncertaintyPenalty": 0.2
    }
  },
  "constraints": {
    "hard": [
      {
        "id": "non-diagnostic-boundary",
        "category": "safety",
        "statement": "The product must not claim to diagnose, treat, prevent, or monitor emergencies; every AI insight must identify its source, date range, uncertainty, and appropriate escalation boundary.",
        "verification": "Claim review, interface copy audit, required evidence fields, and task walkthrough"
      },
      {
        "id": "emergency-path",
        "category": "safety",
        "statement": "Possible emergency content must bypass normal AI guidance and present direct emergency-service instructions without delay.",
        "verification": "Emergency-state fixture and deterministic content assertion"
      },
      {
        "id": "privacy-controls",
        "category": "privacy",
        "statement": "Users must be able to inspect connected sources, understand data use, disconnect a source, export data, delete data, and manage care-partner access.",
        "verification": "Control inventory, interaction test, and privacy-copy review"
      },
      {
        "id": "health-literacy",
        "category": "content",
        "statement": "Essential health information and actions must use plain language, short explanations, descriptive headings, and progressive disclosure.",
        "verification": "Content review against current HHS Health Literacy Online guidance and user comprehension testing"
      },
      {
        "id": "accessibility",
        "category": "accessibility",
        "statement": "Meet WCAG 2.2 AA for tested states with complete keyboard operation and meaning that does not depend on color or motion.",
        "verification": "axe-core, keyboard trace, contrast measurement, reduced-motion capture, and manual review"
      },
      {
        "id": "safe-change",
        "category": "implementation",
        "statement": "Implementation must preserve the protocol runtime and research repository outside declared paths.",
        "verification": "Baseline reference, path allowlist, protected-path review, complete diff, tests, and build"
      }
    ],
    "soft": [
      {
        "id": "performance",
        "category": "performance",
        "statement": "The initial marketing and dashboard views should remain responsive on a mid-range mobile device and avoid unnecessary animation or media weight.",
        "verification": "Production build inspection and browser trace"
      },
      {
        "id": "realistic-fixtures",
        "category": "content",